{
  "presentationSchemaVersion": 1,
  "deckId": "deck:pattern-restoration-public-lesson",
  "title": "图案的还原",
  "engine": {
    "engineId": "adapter:web-ppt",
    "engineVersion": "0.5.0-beta.2",
    "documentFormatVersion": "ooxml"
  },
  "document": {
    "scenes": [
      { "id": "scene:intro", "title": "观察与猜想" },
      { "id": "scene:discussion", "title": "全班讨论" }
    ]
  },
  "classroomBindings": [
    {
      "bindingId": "binding:live-student",
      "widgetType": "classroom:student-live-view",
      "source": {
        "type": "semantic",
        "selector": "teacher-focus",
        "parameters": { "mode": "focus" }
      },
      "fallback": {
        "type": "placeholder",
        "text": "学生实时操作"
      }
    }
  ],
  "createdAt": "2026-09-13T00:00:00Z",
  "updatedAt": "2026-09-13T00:00:00Z"
}
